Attribute,"","branch","","","","Attribute signals that do not change during the power cycle of a vehicle."
Attribute.Body,"","branch","","","","All body components"
Attribute.Body.RefuelPosition,"20","String","","","","Location of the fuel cap or charge port"
Attribute.Body.BodyType,"19","String","","","","Body type code as defined by ISO 3779"
Attribute.Drivetrain,"","branch","","","","Drivetrain attributes internal combustion engines, transmissions, electric motors, etc."
Attribute.Drivetrain.Transmission,"","branch","","","","Transmission-specific attributes, stopping at the drive shafts."
Attribute.Drivetrain.Transmission.DriveType,"","branch","","","","Drive type."
Attribute.Drivetrain.Transmission.Type,"","branch","","","","Transmission type."
Attribute.Drivetrain.Transmission.GearCount,"3","UInt8","","","","Number of forward gears in the transmission. -1 = CVT."
Attribute.Drivetrain.FuelCell,"","branch","","","","Fuel Cell attributes"
Attribute.Drivetrain.BatteryManagement,"","branch","","","","Battery Management attributes"
Attribute.Drivetrain.InternalCombustionEngine,"","branch","","","","Engine-specific attributes, stopping at the bell housing."
Attribute.Drivetrain.InternalCombustionEngine.FuelType,"","branch","","","","Type of fuel that the engine runs on."
Attribute.Drivetrain.InternalCombustionEngine.Configuration,"","branch","","","","Engine configuration."
Attribute.Drivetrain.InternalCombustionEngine.MaxTorque,"2","UInt16","","","","Peak power, in newton meter, that the engine can generate."
Attribute.Drivetrain.InternalCombustionEngine.Displacement,"0","UInt16","","","","Displacement in cubic centimetres."
Attribute.Drivetrain.InternalCombustionEngine.MaxPower,"1","UInt16","","","","Peak power, in kilowatts, that engine can generate."
Attribute.Drivetrain.FuelSystem,"","branch","","","","Fuel System attributes"
Attribute.Drivetrain.FuelSystem.TankCapacity,"4","UInt16","l","","","Capacity of the fuel tank in liters"
Attribute.ADAS,"","branch","","","","All Advanced Driver Assist Systems attributes"
Attribute.Chassis,"","branch","","","","All attributes concerning steering, suspension, wheels, and brakes."
Attribute.Chassis.Track,"18","UInt16","","","","Overall wheel tracking, in mm."
Attribute.Chassis.TowWeight,"13","UInt16","","","","Maximum weight, in kilos, of trailer."
Attribute.Chassis.Width,"16","UInt16","","","","Overall vehicle width, in mm."
Attribute.Chassis.Length,"14","UInt16","","","","Overall vehicle length, in mm."
Attribute.Chassis.Axle,"","branch","","","","Axle configuration attributes"
Attribute.Chassis.Axle.Count,"5","UInt8","","","","Number of axles on the vehicle"
Attribute.Chassis.Axle.Row1,"","branch","","","","Axle configuration attributes for axle row"
Attribute.Chassis.Axle.Row1.WheelCount,"6","UInt8","","","","Number of wheels on the first axle"
Attribute.Chassis.Axle.Row1.WheelWidth,"8","UInt8","inch","","","Width of wheels (without tires), in inches, as per ETRO / TRA standard."
Attribute.Chassis.Axle.Row1.WheelDiameter,"7","UInt8","inch","","","Diameter of wheels (without tires), in inches, as per ETRO / TRA standard."
Attribute.Chassis.Axle.Row2,"","branch","","","","Axle configuration attributes for axle row"
Attribute.Chassis.Axle.Row2.WheelWidth,"10","UInt8","inch","","","Width of wheels (without tires), in inches, as per ETRO / TRA standard."
Attribute.Chassis.Axle.Row2.WheelDiameter,"9","UInt8","inch","","","Diameter of wheels (without tires), in inches, as per ETRO / TRA standard."
Attribute.Chassis.CurbWeight,"11","UInt16","","","","Vehicle curb weight, in kg, including all liquids and full tank of fuel, but no cargo or passengers."
Attribute.Chassis.Height,"15","UInt16","","","","Overall vehicle height, in mm."
Attribute.Chassis.Wheelbase,"17","UInt16","","","","Overall wheel base, in mm."
Attribute.Chassis.GrossWeight,"12","UInt16","","","","Curb weight of vehicle, including all liquids and full tank of fuel and full load of cargo and passengers."
Attribute.Vehicle,"","branch","","","","All Advanced Driver Assist Systems attributes"
Attribute.Vehicle.VehicleIdentification,"","branch","","","","Attributes that identify a vehicle"
Attribute.Vehicle.VehicleIdentification.Model,"33","String","","","","Vehicle model"
Attribute.Vehicle.VehicleIdentification.WMI,"31","String","","","","3-character World Manufacturer Identification (WMI) as defined by ISO 3780"
Attribute.Vehicle.VehicleIdentification.VIN,"30","String","","","","17-character Vehicle Identification Number (VIN) as defined by ISO 3779"
Attribute.Vehicle.VehicleIdentification.Brand,"32","String","","","","Vehicle brand or manufacturer"
Attribute.Vehicle.VehicleIdentification.Year,"34","UInt16","","","","Model year of the vehicle"
Attribute.Cabin,"","branch","","","","All in-cabin components, including doors."
Attribute.Cabin.Seat,"","branch","","","","Seat configuration attributes"
Attribute.Cabin.Seat.Row4PosCount,"28","UInt8","","","","Number of seats across row 4"
Attribute.Cabin.Seat.Row1PosCount,"25","UInt8","","","","Number of seats across row 1 (frontmost)"
Attribute.Cabin.Seat.RowCount,"24","UInt8","","","","Number of seat rows in vehicle"
Attribute.Cabin.Seat.Row5PosCount,"29","UInt8","","","","Number of seats across row 5"
Attribute.Cabin.Seat.Row2PosCount,"26","UInt8","","","","Number of seats across row 3"
Attribute.Cabin.Seat.Row3PosCount,"27","UInt8","","","","Number of seats across row 3"
Attribute.Cabin.Seat.DriverPostion,"23","UInt8","","","","The position of the driver seat in row 1. (1-5)"
Attribute.Cabin.Door,"","branch","","","","Door configuration attributes"
Attribute.Cabin.Door.Count,"21","UInt8","","","","Number of doors in vehicle"
Attribute.Cabin.SteeringWheel,"","branch","","","","Steering wheel configuration attributes"
Attribute.Cabin.SteeringWheel.Position,"22","String","","","","Position of the steering wheel inside the cabin"
Signal,"","branch","","","","All signals that can dynamically be updated by the vehicle"
Signal.Body,"","branch","","","","All body components"
Signal.Body.Mirrors,"","branch","","","","All mirrors"
Signal.Body.Mirrors.Right,"","branch","","","","Right mirrors"
Signal.Body.Mirrors.Right.Tilt,"95","Int8","percentage","","","Mirror tilt as a percentage. 0 = Center Position. 100 = Fully Upward Position. -100 = Fully Downward Position."
Signal.Body.Mirrors.Right.Pan,"96","Int8","percentage","","","Mirror pan as a percentage. 0 = Center Position. 100 = Fully Left Position. -100 = Fully Right Position."
Signal.Body.Mirrors.Right.Heater,"","branch","","","","Mirror heater signals"
Signal.Body.Mirrors.Right.Heater.Status,"97","Boolean","","","","Mirror Heater on or off. True = Heater On. False = Heater Off."
Signal.Body.Mirrors.Left,"","branch","","","","Left mirrors"
Signal.Body.Mirrors.Left.Tilt,"92","Int8","percentage","","","Mirror tilt as a percentage. 0 = Center Position. 100 = Fully Upward Position. -100 = Fully Downward Position."
Signal.Body.Mirrors.Left.Pan,"93","Int8","percentage","","","Mirror pan as a percentage. 0 = Center Position. 100 = Fully Left Position. -100 = Fully Right Position."
Signal.Body.Mirrors.Left.Heater,"","branch","","","","Mirror heater signals"
Signal.Body.Mirrors.Left.Heater.Status,"94","Boolean","","","","Mirror Heater on or off. True = Heater On. False = Heater Off."
Signal.Body.Horn,"","branch","","","","Horn signals"
Signal.Body.Horn.IsActive,"71","Boolean","","","","Horn active or inactive. True = Active. False = Inactive."
Signal.Body.Lights,"","branch","","","","All lgihts"
Signal.Body.Lights.IsLeftIndicatorOn,"90","Boolean","","","","Is left indicator flashing"
Signal.Body.Lights.IsLowBeamOn,"82","Boolean","","","","Is low beam on"
Signal.Body.Lights.IsHighBeamOn,"81","Boolean","","","","Is high beam on"
Signal.Body.Lights.IsFrontFogOn,"88","Boolean","","","","Is front fog light on"
Signal.Body.Lights.IsBrakeOn,"86","Boolean","","","","Is brake light on"
Signal.Body.Lights.IsRightIndicatorOn,"91","Boolean","","","","Is right indicator flashing"
Signal.Body.Lights.IsBackupOn,"84","Boolean","","","","Is backup (reverse) light on"
Signal.Body.Lights.IsParkingOn,"85","Boolean","","","","Is parking light on"
Signal.Body.Lights.IsRearFogOn,"87","Boolean","","","","Is rear fog light on"
Signal.Body.Lights.IsHazardOn,"89","Boolean","","","","Are hazards on"
Signal.Body.Lights.IsRunningOn,"83","Boolean","","","","Are running lights on"
Signal.Body.Rainsensor,"","branch","","","","Rainsensor signals"
Signal.Body.Rainsensor.Intensity,"72","UInt8","percentage","","","Rain intensity. 0 = Dry, No Rain. 100 = Covered."
Signal.Body.Trunk,"","branch","","","","Trunk status"
Signal.Body.Trunk.IsLocked,"70","Boolean","","","","Is trunk locked or unlocked. True = Locked. False = Unlocked."
Signal.Body.Trunk.IsOpen,"69","Boolean","","","","Trunk open or closed. True = Open. False = Closed"
Signal.Body.Windshield,"","branch","","","","Windshield signals"
Signal.Body.Windshield.Front,"","branch","","","","Front windshield signals"
Signal.Body.Windshield.Front.Heater,"","branch","","","","Front windshield heater signals"
Signal.Body.Windshield.Front.Heater.Status,"74","String","","","","Front windshield heater status"
Signal.Body.Windshield.Front.Wiper,"","branch","","","","Front windshield wiper signals"
Signal.Body.Windshield.Front.Wiper.Status,"73","String","","","","Front wiper status"
Signal.Body.Windshield.Front.WasherFluid,"","branch","","","","Front windshield washer fluid signals"
Signal.Body.Windshield.Front.WasherFluid.LevelLow,"75","Boolean","","","","Low level indication for washer fluid. True = Level Low. False = Level OK."
Signal.Body.Windshield.Front.WasherFluid.Level,"76","UInt8","percent","","","Washer fluid level as a percentage. 0 = Empty. 100 = Full."
Signal.Body.Windshield.Rear,"","branch","","","","Rear sindshield signals"
Signal.Body.Windshield.Rear.Heater,"","branch","","","","Rear windshield heater signals"
Signal.Body.Windshield.Rear.Heater.Status,"78","String","","","","Rear windshield heater status"
Signal.Body.Windshield.Rear.Wiper,"","branch","","","","Rear windshield wiper signals"
Signal.Body.Windshield.Rear.Wiper.Status,"77","String","","","","Rear wiper status"
Signal.Body.Windshield.Rear.WasherFluid,"","branch","","","","Rear windshield washer fluid signals"
Signal.Body.Windshield.Rear.WasherFluid.LevelLow,"79","Boolean","","","","Low level indication for washer fluid. True = Level Low. False = Level OK."
Signal.Body.Windshield.Rear.WasherFluid.Level,"80","UInt8","percent","","","Washer fluid level as a percentage. 0 = Empty. 100 = Full."
Signal.Body.Hood,"","branch","","","","Hood status"
Signal.Body.Hood.IsOpen,"68","Boolean","","","","hood open or closed. True = Open. False = Closed"
Signal.Drivetrain,"","branch","","","","Drivetrain data for internal combustion engines, transmissions, electric motors, etc."
Signal.Drivetrain.FuelCell,"","branch","","","","Fuel Cell signals"
Signal.Drivetrain.FuelSystem,"","branch","","","","Fuel system signals"
Signal.Drivetrain.FuelSystem.ConsumptionSinceStart,"66","UInt32","ml","","","Fuel amount consumed since start in milliliters."
Signal.Drivetrain.FuelSystem.TimeSinceStart,"67","UInt32","s","","","Time elapsed since start in seconds."
Signal.Drivetrain.FuelSystem.InstantConsumption,"64","UInt32","ml/100km","","","Current consumption in milliliters per 100 km."
Signal.Drivetrain.FuelSystem.Level,"62","UInt8","percentage","","","Level in fuel tank as percentage of capacity. 0 = empty. 100 = full."
Signal.Drivetrain.FuelSystem.Range,"63","UInt32","m","","","Range in meters."
Signal.Drivetrain.FuelSystem.AverageConsumption,"65","UInt32","ml/100km","","","Average consumption in milliliters per 100 km."
Signal.Drivetrain.Transmission,"","branch","","","","Transmission-specific data, stopping at the drive shafts."
Signal.Drivetrain.Transmission.Gear,"55","UInt8","","-1","16","Current gear. 0=Neutral. -1=Reverse"
Signal.Drivetrain.Transmission.Odometer,"59","UInt32","m","","","Odometer reading"
Signal.Drivetrain.Transmission.PerformanceMode,"56","String","","","","Current gearbox performance mode."
Signal.Drivetrain.Transmission.ClutchWear,"61","UInt8","percentage","","","Clutch wear as a percentage. 0 = no wear. 100 = worn."
Signal.Drivetrain.Transmission.TripMeter,"60","UInt32","m","","","Current trip meter reading"
Signal.Drivetrain.Transmission.Speed,"54","Int32","m/s","-250","250","Vehicle speed, as sensed by the gearbox."
Signal.Drivetrain.Transmission.GearChangeMode,"57","String","","","","Is the gearbox in automatic or manual (paddle) mode."
Signal.Drivetrain.Transmission.Temperature,"58","Int16","celsius","-50","200","The current gearbox temperature"
Signal.Drivetrain.ElectricMotor,"","branch","","","","Electric Motor specific signals."
Signal.Drivetrain.InternalCombustionEngine,"","branch","","","","Engine-specific data, stopping at the bell housing."
Signal.Drivetrain.InternalCombustionEngine.EOP,"51","Int16","mbar","0","10000","Engine oil pressure."
Signal.Drivetrain.InternalCombustionEngine.MAP,"48","Int16","mbar","0","10000","Manifold air pressure possibly boosted using forced induction."
Signal.Drivetrain.InternalCombustionEngine.Power,"52","Int16","kW","0","2000","Current engine power output."
Signal.Drivetrain.InternalCombustionEngine.EOT,"47","Int16","celsius","-50","300","Engine oil temperature."
Signal.Drivetrain.InternalCombustionEngine.Torque,"53","Int16","Nm","0","3000","Current engine torque."
Signal.Drivetrain.InternalCombustionEngine.ECT,"46","Int16","celsius","-50","200","Engine coolant temperature."
Signal.Drivetrain.InternalCombustionEngine.TPS,"50","Int8","percent","0","100","Current throttle position."
Signal.Drivetrain.InternalCombustionEngine.MAF,"49","Int16","g/s","0","3000","Grams of air drawn into engine per second."
Signal.Drivetrain.InternalCombustionEngine.RPM,"45","UInt16","rpm","0","20000","Engine speed measured as rotations per minute."
Signal.Drivetrain.BatteryManagement,"","branch","","","","Battery Management signals"
Signal.ADAS,"","branch","","","","All Advanced Driver Assist Systems signals"
Signal.ADAS.ObstacleSensor,"","branch","","","","Signals form Obstacle Sensor System"
Signal.ADAS.ObstacleSensor.DistanceToObject,"","branch","","","","Distance signals form Obstacle Sensor System"
Signal.ADAS.ObstacleSensor.DistanceToObject.RearLeft,"926","UInt16","mm","","","Rear left distance to object in millimeters"
Signal.ADAS.ObstacleSensor.DistanceToObject.FrontLeft,"924","UInt16","mm","","","Front left distance to object in millimeters"
Signal.ADAS.ObstacleSensor.DistanceToObject.FrontRight,"925","UInt16","mm","","","Front right distance to object in millimeters"
Signal.ADAS.ObstacleSensor.DistanceToObject.RearRight,"927","UInt16","mm","","","Rear right distance to object in millimeters"
Signal.ADAS.ObstacleSensor.IsActive,"922","Boolean","","","","Indicates if obstacle sensor system is enabled. Tue = Enabled. False = Disabled."
Signal.ADAS.ObstacleSensor.Error,"923","Boolean","","","","Indicates if obstacle sensor system incurred an error condition. True = Error. False = No Error."
Signal.ADAS.TCS,"","branch","","","","Traction Control System signals"
Signal.ADAS.TCS.IsEngaged,"933","Boolean","","","","Indicates if TCS is currently regulating traction. True = Engaged. False = Not Engaged."
Signal.ADAS.TCS.IsActive,"931","Boolean","","","","Indicates if TCS is enabled. Tue = Enabled. False = Disabled."
Signal.ADAS.TCS.Error,"932","Boolean","","","","Indicates if TCS incurred an error condition. True = Error. False = No Error."
Signal.ADAS.CruiseControl,"","branch","","","","Signals from Cruise Control system"
Signal.ADAS.CruiseControl.SpeedSet,"917","Int32","mps","","","Set cruise control speed in meters per hour"
Signal.ADAS.CruiseControl.IsActive,"916","Boolean","","","","Indicates if cruise control system is enabled. True = Enabled. False = Disabled."
Signal.ADAS.CruiseControl.Error,"918","Boolean","","","","Indicates if cruise control system incurred and error condition. True = Error. False = NoError."
Signal.ADAS.ABS,"","branch","","","","Antilock Braking System signals"
Signal.ADAS.ABS.IsEngaged,"930","Boolean","","","","Indicates if ABS is currently regulating brake pressure. True = Engaged. False = Not Engaged."
Signal.ADAS.ABS.IsActive,"928","Boolean","","","","Indicates if ABS is enabled. Tue = Enabled. False = Disabled."
Signal.ADAS.ABS.Error,"929","Boolean","","","","Indicates if ABS incurred an error condition. True = Error. False = No Error."
Signal.ADAS.ESC,"","branch","","","","Electronig Stability Control System signals"
Signal.ADAS.ESC.IsEngaged,"936","Boolean","","","","Indicates if ESC is currently regulating vehicle stability. True = Engaged. False = Not Engaged."
Signal.ADAS.ESC.IsActive,"934","Boolean","","","","Indicates if ECS is enabled. Tue = Enabled. False = Disabled."
Signal.ADAS.ESC.Error,"935","Boolean","","","","Indicates if ESC incurred an error condition. True = Error. False = No Error."
Signal.ADAS.LaneDepartureDetection,"","branch","","","","Signals from Land Departure Detection System"
Signal.ADAS.LaneDepartureDetection.Warning,"920","Boolean","","","","Indicates if lane departure detection registered a lane departure"
Signal.ADAS.LaneDepartureDetection.IsActive,"919","Boolean","","","","Indicates if lane departure detection system is enabled. True = Enabled. False = Disabled."
Signal.ADAS.LaneDepartureDetection.Error,"921","Boolean","","","","Indicates if lane departure system incurred an error condition. True = Error. False = No Error."
Signal.Chassis,"","branch","","","","All signals concerning steering, suspension, wheels, and brakes."
Signal.Chassis.Accelerator,"","branch","","","","Accelerator signals"
Signal.Chassis.Accelerator.PedalPosition,"969","UInt8","percentage","","","Accelerator pedal position as percentage. 0 = Not depressed. 100 = Fully depressed."
Signal.Chassis.Brake,"","branch","","","","Brake system signals"
Signal.Chassis.Brake.PedalPosition,"970","UInt8","percentage","","","Brake pedal position as percentage. 0 = Not depressed. 100 = Fully depressed."
Signal.Chassis.ParkingBrake,"","branch","","","","Parking brake signals"
Signal.Chassis.ParkingBrake.IsEngaged,"965","Boolean","","","","Parking brake status. True = Parking Brake is Engaged. False = Parking Brake is not Engaged."
Signal.Chassis.Axle,"","branch","","","","Axle signals"
Signal.Chassis.Axle.Row1,"","branch","","","","Axle signals for first row"
Signal.Chassis.Axle.Row1.Wheel,"","branch","","","","Brake signals for first row"
Signal.Chassis.Axle.Row1.Wheel.Right,"","branch","","","","Row1 wheel right."
Signal.Chassis.Axle.Row1.Wheel.Right.Brake,"","branch","","","","Brake signals for wheel"
Signal.Chassis.Axle.Row1.Wheel.Right.Brake.FluidLevel,"944","UInt8","percentage","","","Brake fluid level as percentage. 0 = Empty. 100 = Full."
Signal.Chassis.Axle.Row1.Wheel.Right.Brake.FluidLevelLow,"945","Boolean","","","","Brake fluid level status. True = Brake fluid level low. False = Brake fluid level ok."
Signal.Chassis.Axle.Row1.Wheel.Right.Brake.BrakesWorn,"947","Boolean","","","","Brake pad wear status. True = Worn. False = Not Worn."
Signal.Chassis.Axle.Row1.Wheel.Right.Brake.PadWear,"946","UInt8","","","","Brake pad wear as percentage. 0 = No Wear. 100 = Worn."
Signal.Chassis.Axle.Row1.Wheel.Right.Tire,"","branch","","","","Tire signals for wheel"
Signal.Chassis.Axle.Row1.Wheel.Right.Tire.Pressure,"948","UInt8","kpa","","","Tire pressure in kilo-Pascal"
Signal.Chassis.Axle.Row1.Wheel.Right.Tire.PressureLow,"949","Boolean","","","","Tire Pressure Status. True = Low tire pressure. False = Good tire pressure."
Signal.Chassis.Axle.Row1.Wheel.Right.Tire.Temperature,"950","Float","celsius","","","Tire temperature in Celsius."
Signal.Chassis.Axle.Row1.Wheel.Left,"","branch","","","","Row1 wheel left."
Signal.Chassis.Axle.Row1.Wheel.Left.Brake,"","branch","","","","Brake signals for wheel"
Signal.Chassis.Axle.Row1.Wheel.Left.Brake.FluidLevel,"937","UInt8","percentage","","","Brake fluid level as percentage. 0 = Empty. 100 = Full."
Signal.Chassis.Axle.Row1.Wheel.Left.Brake.FluidLevelLow,"938","Boolean","","","","Brake fluid level status. True = Brake fluid level low. False = Brake fluid level ok."
Signal.Chassis.Axle.Row1.Wheel.Left.Brake.BrakesWorn,"940","Boolean","","","","Brake pad wear status. True = Worn. False = Not Worn."
Signal.Chassis.Axle.Row1.Wheel.Left.Brake.PadWear,"939","UInt8","","","","Brake pad wear as percentage. 0 = No Wear. 100 = Worn."
Signal.Chassis.Axle.Row1.Wheel.Left.Tire,"","branch","","","","Tire signals for wheel"
Signal.Chassis.Axle.Row1.Wheel.Left.Tire.Pressure,"941","UInt8","kpa","","","Tire pressure in kilo-Pascal"
Signal.Chassis.Axle.Row1.Wheel.Left.Tire.PressureLow,"942","Boolean","","","","Tire Pressure Status. True = Low tire pressure. False = Good tire pressure."
Signal.Chassis.Axle.Row1.Wheel.Left.Tire.Temperature,"943","Float","celsius","","","Tire temperature in Celsius."
Signal.Chassis.Axle.Row2,"","branch","","","","Axle signals for second row"
Signal.Chassis.Axle.Row2.Wheel,"","branch","","","","Wheel signals for second row"
Signal.Chassis.Axle.Row2.Wheel.Right,"","branch","","","","Row2 wheel right."
Signal.Chassis.Axle.Row2.Wheel.Right.Brake,"","branch","","","","Brake signals for wheel"
Signal.Chassis.Axle.Row2.Wheel.Right.Brake.FluidLevel,"958","UInt8","percentage","","","Brake fluid level as percentage. 0 = Empty. 100 = Full."
Signal.Chassis.Axle.Row2.Wheel.Right.Brake.FluidLevelLow,"959","Boolean","","","","Brake fluid level status. True = Brake fluid level low. False = Brake fluid level ok."
Signal.Chassis.Axle.Row2.Wheel.Right.Brake.BrakesWorn,"961","Boolean","","","","Brake pad wear status. True = Worn. False = Not Worn."
Signal.Chassis.Axle.Row2.Wheel.Right.Brake.PadWear,"960","UInt8","","","","Brake pad wear as percentage. 0 = No Wear. 100 = Worn."
Signal.Chassis.Axle.Row2.Wheel.Right.Tire,"","branch","","","","Tire signals for wheel"
Signal.Chassis.Axle.Row2.Wheel.Right.Tire.Pressure,"962","UInt8","kpa","","","Tire pressure in kilo-Pascal"
Signal.Chassis.Axle.Row2.Wheel.Right.Tire.PressureLow,"963","Boolean","","","","Tire Pressure Status. True = Low tire pressure. False = Good tire pressure."
Signal.Chassis.Axle.Row2.Wheel.Right.Tire.Temperature,"964","Float","celsius","","","Tire temperature in Celsius."
Signal.Chassis.Axle.Row2.Wheel.Left,"","branch","","","","Row2 wheel left."
Signal.Chassis.Axle.Row2.Wheel.Left.Brake,"","branch","","","","Brake signals for wheel"
Signal.Chassis.Axle.Row2.Wheel.Left.Brake.FluidLevel,"951","UInt8","percentage","","","Brake fluid level as percentage. 0 = Empty. 100 = Full."
Signal.Chassis.Axle.Row2.Wheel.Left.Brake.FluidLevelLow,"952","Boolean","","","","Brake fluid level status. True = Brake fluid level low. False = Brake fluid level ok."
Signal.Chassis.Axle.Row2.Wheel.Left.Brake.BrakesWorn,"954","Boolean","","","","Brake pad wear status. True = Worn. False = Not Worn."
Signal.Chassis.Axle.Row2.Wheel.Left.Brake.PadWear,"953","UInt8","","","","Brake pad wear as percentage. 0 = No Wear. 100 = Worn."
Signal.Chassis.Axle.Row2.Wheel.Left.Tire,"","branch","","","","Tire signals for wheel"
Signal.Chassis.Axle.Row2.Wheel.Left.Tire.Pressure,"955","UInt8","kpa","","","Tire pressure in kilo-Pascal"
Signal.Chassis.Axle.Row2.Wheel.Left.Tire.PressureLow,"956","Boolean","","","","Tire Pressure Status. True = Low tire pressure. False = Good tire pressure."
Signal.Chassis.Axle.Row2.Wheel.Left.Tire.Temperature,"957","Float","celsius","","","Tire temperature in Celsius."
Signal.Chassis.SteeringWheel,"","branch","","","","Steering wheel signals"
Signal.Chassis.SteeringWheel.Tilt,"967","UInt8","percentage","","","Steering wheel column tilt. 0 = Lowest position. 100 = Highest position."
Signal.Chassis.SteeringWheel.Angle,"966","Int16","degree","","","Steering wheel angle. Positive = degrees to the left. Negative = degrees to the right."
Signal.Chassis.SteeringWheel.Extension,"968","UInt8","percentage","","","Steering wheel column extension from dashboard. 0 = Closest to dashboard. 100 = Furthest from dashboard."
Signal.Vehicle,"","branch","","","","Highlevel vehicle data."
Signal.Vehicle.Acceleration,"","branch","","","","Spacial acceleration"
Signal.Vehicle.Acceleration.Y,"40","Int32","cm/s2","","","Vehicle acceleration in Y (lateral acceleration)."
Signal.Vehicle.Acceleration.X,"39","Int32","cm/s2","","","Vehicle acceleration in X (longitudinal acceleration)."
Signal.Vehicle.Acceleration.Yaw,"44","Int16","degrees/s","","","Vehicle rotatin rate along Z (vertical)."
Signal.Vehicle.Acceleration.Z,"41","Int32","cm/s2","","","Vehicle acceleration in Z (vertical acceleration)."
Signal.Vehicle.Acceleration.Pitch,"43","Int16","degrees/s","","","Vehicle rotation rate along Y (lateral)."
Signal.Vehicle.IdleTime,"38","UInt32","s","","","Accumulated idle time in seconds."
Signal.Vehicle.DriveTime,"37","UInt32","s","","","Accumulated drive time in seconds."
Signal.Vehicle.Gyro,"","branch","","","","Spacial rotation"
Signal.Vehicle.Gyro.Roll,"42","Int16","degrees/s","","","Vehicle rotation rate along X (longitudinal)."
Signal.Vehicle.IgnitionOffTime,"36","UInt32","s","","","Accumulated ignition off time in seconds."
Signal.Vehicle.IgnitionOnTime,"35","UInt32","s","","","Accumulated ignition on time in seconds."
Signal.Cabin,"","branch","","","","All in-cabin components, including doors."
Signal.Cabin.Door,"","branch","","","","All doors, including windows and switches"
Signal.Cabin.Door.Row1,"","branch","","","","Front doors"
Signal.Cabin.Door.Row1.Right,"","branch","","","","Right front door"
Signal.Cabin.Door.Row1.Right.IsChildLockActive,"171","Boolean","","","","Is door child lock engaged. Trnue = Engaged. False = Disengaged."
Signal.Cabin.Door.Row1.Right.IsLocked,"168","Boolean","","","","Is door locked or unlocked. True = Locked. False = Unlocked."
Signal.Cabin.Door.Row1.Right.Shade,"","branch","","","","Side window shade"
